status,year,date,talk,organizer,event,event_link,recording_link,sm_link,image_link,type,location,language,abstract,tags
,2022,2022-09-21,PLN con SomosNLP y Hugging Face,AI The New Sexy,AI The New Sexy,,https://open.spotify.com/episode/38Y2K2gAe8IujRZOMjv1BH?si=S8VO6ifPT4WYWLbSLr91tg,,images/logos/AITheNewSexy.jpeg,Podcast Interview,Remote 🌐,Spanish,"AI The New Sexy is a podcast where you can find information about Artificial Intelligence and its impact on everyday life and on business. In this episode we interview María Grandury, founder of SomosNLP (formerly NLP en ES), an open community for Spanish-speaking professionals and researchers advancing and democratizing NLP in their language.","NLP in Spanish, Career, Open-Source, Interview, 🇪🇸"
,2021,2021-11-30,Tecnologías del Lenguaje en la Empresa,DiverTLes: Diversidad en Tecnologías del Lenguaje en España,DiverTLes: Diversidad en Tecnologías del Lenguaje en España,https://gplsi.dlsi.ua.es/pln/divertles,https://www.youtube.com/watch?v=yvPLMc3-KnI,,images/events/211130_divertles.jfif,Round Table,Spain (Remote) 🇪🇸,Spanish,"Three professionals working in NLP in a company discuss how they use NLP for real-world applications. María works in Germany at neurocat, a startup specialized in Explainable AI and Robustness that develops a tool to assess the quality and trustworthiness of any ML model. Muntsa works in France at Eloquant, a company that develops software used to extract information from text and audio to improve the customer relationship. Melania works in Spain at Adecco Outsourcing and is currently developing NLP solutions for Google products, mainly Google Assistant but also Google Maps, Google Home and GMail.","NLP, NLP in Production, Research, Women in AI"
,2021,2022-01-27,IAs que hablan español,Saturdays.AI,Saturdays.AI,https://saturdays.ai/2022/01/27/3x07-maria-grandury-ai-que-hablan-espanol/,https://www.youtube.com/watch?v=O5QkrbOrxd4,,images/logos/SaturdaysAIPodcast.jpg,Podcast Interview,Remote 🌐,Spanish,"Interview for the Saturdays.AI Podcast where I discuss with its founder Miguel Guerrero how I became an ML Research Engineer, what are we doing at BigScience <a href=""https://bigscience.huggingface.co/"" target=""_blank"" class=""text-accent-500 hover:underline"">BigScience,</a> and how I founded <a href=""https://somosnlp.org"" target=""_blank"" class=""text-accent-500 hover:underline"">SomosNLP,</a> amongst other topics like privacy, AI regulation and why most of the AI-related movies picture AI as ""the bad guy"".","My Story, NLP, AI Regulation, Interview, 🇪🇸"
,2021,2021-07-13,II. Sequential Models,SomosNLP & Spain AI,NLP de 0 a 100 con Hugging Face | Course by SomosNLP & Spain AI,https://somosnlp.org/nlp-de-cero-a-cien,https://somosnlp.org/nlp-de-cero-a-cien/sesion-03,,images/events/210713_nlp_de_cero_a_cien.jpeg,Course,Remote 🌐,Spanish,"Understand all the key concepts and architectures of state-of-the-art NLP and apply them to common use cases using one of the most popular libraries in the field: Hugging Face. Regardless of your current knowledge, you will finish the course talking about Word Embeddings, Sequential Models, Attention Mechanisms, Transformers and Language Modelling. <br /> <br /> This course was organized by <a href=""https://somosnlp.org"" target=""_blank"" class=""text-accent-500 hover:underline"">SomosNLP</a> with the support of <a href=""https://www.spain-ai.com/"" target=""_blank"" class=""text-accent-500 hover:underline"">Spain AI.</a>","NLP, Sequential Models, Transformers, NLP Demos, Course, 🇪🇸"
,2021,2021-07-13,III. The Transformer Architecture,SomosNLP & Spain AI,NLP de 0 a 100 con Hugging Face | Course by SomosNLP & Spain AI,https://somosnlp.org/nlp-de-cero-a-cien,https://somosnlp.org/nlp-de-cero-a-cien/sesion-03,,images/events/210713_nlp_de_cero_a_cien.jpeg,Course,Remote 🌐,Spanish,"Understand all the key concepts and architectures of state-of-the-art NLP and apply them to common use cases using one of the most popular libraries in the field: Hugging Face. Regardless of your current knowledge, you will finish the course talking about Word Embeddings, Sequential Models, Attention Mechanisms, Transformers and Language Modelling. <br /> <br /> This course was organized by <a href=""https://somosnlp.org"" target=""_blank"" class=""text-accent-500 hover:underline"">SomosNLP</a> with the support of <a href=""https://www.spain-ai.com/"" target=""_blank"" class=""text-accent-500 hover:underline"">Spain AI.</a>","NLP, Sequential Models, Transformers, NLP Demos, Course, 🇪🇸"
,2021,2021-06-22,"3 Engineering, Robotics & AI experts Taking Center Stage","Women in AI & Robotics, NASA JPL, UniBremen, DFKI","Women in AI & Robotics, NASA JPL, UniBremen, DFKI",https://www.eventbrite.de/e/3-engineering-robotics-ai-experts-taking-center-stage-tickets-158193696605,https://www.youtube.com/watch?v=f2f1RL3M6xc,,images/events/210622_wair_3_engineers.avif,Round Table,Germany (Remote) 🇩🇪,English,"AI and Robotics go hand in hand, whether exploring space or enabling humanoid robots to walk on the Moon. As a cutting edge branch of technology, having women representation in AI and Robotics is extremely important - both for the progress of the field and to encourage younger generations to join in as well. <br /> <br /> Join us as our very own Maria Grandury, herself a Machine Learning Research Engineer, interviews Sandra Hernandez, Systems Engineer at NASA JPL, and Mihaela Popescu, Researcher at University of Bremen/DFKI (German Research Center for Artificial Intelligence) and Bremen Women in AI & Robotics core team member. Discover their journeys into the technical world, their fascinating work at NASA and DFKI Robotics and their advice for women who wish to enter STEM related fields.","Women in Robotics, Women Engineers, Round Table, 🇬🇧"
,2021,2021-06-14,Is Your ML Model Trustworthy?,MLOps World Conference,MLOps World Conference 2021,https://mlopsworld.com/,https://twitter.com/MLOpsWorld/status/1405179157265489927,,images/events/210614_mlops_world.jpg,Workshop,Canada (Remote) 🇨🇦,English,"In recent years, Machine Learning models and architectures have become increasingly complex. This growing complexity makes it more difficult to deliver high quality in terms of model performance, robustness and explainability. The introduction of automated evaluations of the trustworthiness of a model is one solution to guarantee that your clients can rely on your model's predictions. This talk will guide you through the different AI quality pillars, their importance and how to evaluate them.","MLOps, AI Robustness, AI Explainability, Talk, 🇬🇧"
,2021,2021-06-10,Hands-on NLP with Hugging Face,WomenTech Global Conference,WomenTech Global Conference 2021,,https://www.womentech.net/speaker/Maria/Grandury/57995,,images/events/210610_wtn.png,Workshop,US (Remote) 🇺🇸,English,"Hands-on introduction to the state-of-the-art Hugging Face NLP libraries. Natural Language Processing (NLP) has evolved greatly and become increasingly popular in recent years, especially since the introduction in 2017 of the Transformer architecture. Thanks to the open-source Hugging Face libraries, we all have access to cutting-edge NLP models that can be easily used to address a wide range of tasks.","NLP, Transformers, Hugging Face, Workshop, 🇬🇧"
,2021,2021-03-08,Meet 8 International Inspirational Women on March 8,Women in AI & Robotics,Women in AI & Robotics,,https://medium.com/womeninairobotics/inspirational-women-in-ai-85b80cb4999f,,images/events/210308_meet_8_women.png,Blog Post,Germany (Remote) 🇩🇪,English,Blog article published on the Medium account of Women in AI & Robotics about 8 international inspirational women working in the fields of AI & Robotics.,"Women in AI, Women in Robotics, 🇬🇧"
,2021,2021-05-06,WAIR Kick-Off Event,Women in AI & Robotics,Women in AI & Robotics,,https://www.youtube.com/watch?v=in5tEluYTSs,,images/events/210506_wair_kick_off.avif,Round Table,Germany (Remote) 🇩🇪,English,"The field of Artificial Intelligence and Robotics is challenging and rapidly growing and yet women are under-represented. We are on a mission to change that. Come join us in this event where five of our members will talk about what motivated to enter this field, their experiences, challenges, support systems, sources of inspiration and what we do at Women in AI & Robotics.","Women in AI, Women in STEM, Round Table, 🇬🇧"
,
